{
  "all_controls_pass": true,
  "basis_invariance_row_count": 825,
  "basis_invariance_rows": [
    {
      "entropy_drift_bits": 0.0,
      "reduced_entropy_bits": -0.0,
      "rotated_measurement_entropy_bits": -0.0,
      "rotation_angle": 0.0,
      "theta": 0.0
    },
    {
      "entropy_drift_bits": 0.0,
      "reduced_entropy_bits": -0.0,
      "rotated_measurement_entropy_bits": 0.0519252884,
      "rotation_angle": 0.06544985,
      "theta": 0.0
    },
    {
      "entropy_drift_bits": 0.0,
      "reduced_entropy_bits": 0.0,
      "rotated_measurement_entropy_bits": 0.1642828245,
      "rotation_angle": 0.13089969,
      "theta": 0.0
    },
    {
      "entropy_drift_bits": 0.0,
      "reduced_entropy_bits": -0.0,
      "rotated_measurement_entropy_bits": 0.3115054311,
      "rotation_angle": 0.19634954,
      "theta": 0.0
    },
    {
      "entropy_drift_bits": 0.0,
      "reduced_entropy_bits": -0.0,
      "rotated_measurement_entropy_bits": 0.4790435537,
      "rotation_angle": 0.26179939,
      "theta": 0.0
    },
    {
      "entropy_drift_bits": 0.0,
      "reduced_entropy_bits": -0.0,
      "rotated_measurement_entropy_bits": 0.6561479429,
      "rotation_angle": 0.32724923,
      "theta": 0.0
    },
    {
      "entropy_drift_bits": 0.0,
      "reduced_entropy_bits": -0.0,
      "rotated_measurement_entropy_bits": 0.8342026653,
      "rotation_angle": 0.39269908,
      "theta": 0.0
    },
    {
      "entropy_drift_bits": 0.0,
      "reduced_entropy_bits": -0.0,
      "rotated_measurement_entropy_bits": 1.0060820392,
      "rotation_angle": 0.45814893,
      "theta": 0.0
    },
    {
      "entropy_drift_bits": 0.0,
      "reduced_entropy_bits": -0.0,
      "rotated_measurement_entropy_bits": 1.1658570271,
      "rotation_angle": 0.52359878,
      "theta": 0.0
    },
    {
      "entropy_drift_bits": 0.0,
      "reduced_entropy_bits": 0.0,
      "rotated_measurement_entropy_bits": 1.3086509875,
      "rotation_angle": 0.58904862,
      "theta": 0.0
    },
    {
      "entropy_drift_bits": 0.0,
      "reduced_entropy_bits": -0.0,
      "rotated_measurement_entropy_bits": 1.4305670339,
      "rotation_angle": 0.65449847,
      "theta": 0.0
    },
    {
      "entropy_drift_bits": 0.0,
      "reduced_entropy_bits": -0.0,
      "rotated_measurement_entropy_bits": 1.5286515571,
      "rotation_angle": 0.71994832,
      "theta": 0.0
    },
    {
      "entropy_drift_bits": 0.0,
      "reduced_entropy_bits": 0.0,
      "rotated_measurement_entropy_bits": 1.6008760367,
      "rotation_angle": 0.78539816,
      "theta": 0.0
    },
    {
      "entropy_drift_bits": 0.0,
      "reduced_entropy_bits": -0.0,
      "rotated_measurement_entropy_bits": 1.6461276841,
      "rotation_angle": 0.85084801,
      "theta": 0.0
    },
    {
      "entropy_drift_bits": 0.0,
      "reduced_entropy_bits": -0.0,
      "rotated_measurement_entropy_bits": 1.664204065,
      "rotation_angle": 0.91629786,
      "theta": 0.0
    },
    {
      "entropy_drift_bits": 0.0,
      "reduced_entropy_bits": -0.0,
      "rotated_measurement_entropy_bits": 1.6558098444,
      "rotation_angle": 0.9817477,
      "theta": 0.0
    },
    {
      "entropy_drift_bits": 0.0,
      "reduced_entropy_bits": -0.0,
      "rotated_measurement_entropy_bits": 1.6225562489,
      "rotation_angle": 1.04719755,
      "theta": 0.0
    },
    {
      "entropy_drift_bits": 0.0,
      "reduced_entropy_bits": -0.0,
      "rotated_measurement_entropy_bits": 1.5669665374,
      "rotation_angle": 1.1126474,
      "theta": 0.0
    },
    {
      "entropy_drift_bits": 0.0,
      "reduced_entropy_bits": -0.0,
      "rotated_measurement_entropy_bits": 1.4924946386,
      "rotation_angle": 1.17809725,
      "theta": 0.0
    },
    {
      "entropy_drift_bits": 0.0,
      "reduced_entropy_bits": 0.0,
      "rotated_measurement_entropy_bits": 1.4035709402,
      "rotation_angle": 1.24354709,
      "theta": 0.0
    },
    {
      "entropy_drift_bits": 0.0,
      "reduced_entropy_bits": 0.0,
      "rotated_measurement_entropy_bits": 1.3057033009,
      "rotation_angle": 1.30899694,
      "theta": 0.0
    },
    {
      "entropy_drift_bits": 0.0,
      "reduced_entropy_bits": -0.0,
      "rotated_measurement_entropy_bits": 1.2056951116,
      "rotation_angle": 1.37444679,
      "theta": 0.0
    },
    {
      "entropy_drift_bits": 0.0,
      "reduced_entropy_bits": -0.0,
      "rotated_measurement_entropy_bits": 1.112139854,
      "rotation_angle": 1.43989663,
      "theta": 0.0
    },
    {
      "entropy_drift_bits": 0.0,
      "reduced_entropy_bits": -0.0,
      "rotated_measurement_entropy_bits": 1.0367303558,
      "rotation_angle": 1.50534648,
      "theta": 0.0
    },
    {
      "entropy_drift_bits": 0.0,
      "reduced_entropy_bits": -0.0,
      "rotated_measurement_entropy_bits": 1.0,
      "rotation_angle": 1.57079633,
      "theta": 0.0
    },
    {
      "entropy_drift_bits": 0.0,
      "reduced_entropy_bits": 0.0073113146,
      "rotated_measurement_entropy_bits": 0.0073113146,
      "rotation_angle": 0.0,
      "theta": 0.02454369
    },
    {
      "entropy_drift_bits": 0.0,
      "reduced_entropy_bits": 0.0073113146,
      "rotated_measurement_entropy_bits": 0.0584034092,
      "rotation_angle": 0.06544985,
      "theta": 0.02454369
    },
    {
      "entropy_drift_bits": 0.0,
      "reduced_entropy_bits": 0.0073113146,
      "rotated_measurement_entropy_bits": 0.1696094634,
      "rotation_angle": 0.13089969,
      "theta": 0.02454369
    },
    {
      "entropy_drift_bits": 0.0,
      "reduced_entropy_bits": 0.0073113146,
      "rotated_measurement_entropy_bits": 0.3157690861,
      "rotation_angle": 0.19634954,
      "theta": 0.02454369
    },
    {
      "entropy_drift_bits": 0.0,
      "reduced_entropy_bits": 0.0073113146,
      "rotated_measurement_entropy_bits": 0.4823747203,
      "rotation_angle": 0.26179939,
      "theta": 0.02454369
    },
    {
      "entropy_drift_bits": 0.0,
      "reduced_entropy_bits": 0.0073113146,
      "rotated_measurement_entropy_bits": 0.6586663712,
      "rotation_angle": 0.32724923,
      "theta": 0.02454369
    },
    {
      "entropy_drift_bits": 0.0,
      "reduced_entropy_bits": 0.0073113146,
      "rotated_measurement_entropy_bits": 0.8360130837,
      "rotation_angle": 0.39269908,
      "theta": 0.02454369
    },
    {
      "entropy_drift_bits": 0.0,
      "reduced_entropy_bits": 0.0073113146,
      "rotated_measurement_entropy_bits": 1.0072778959,
      "rotation_angle": 0.45814893,
      "theta": 0.02454369
    },
    {
      "entropy_drift_bits": 0.0,
      "reduced_entropy_bits": 0.0073113146,
      "rotated_measurement_entropy_bits": 1.1665243891,
      "rotation_angle": 0.52359878,
      "theta": 0.02454369
    },
    {
      "entropy_drift_bits": 0.0,
      "reduced_entropy_bits": 0.0073113146,
      "rotated_measurement_entropy_bits": 1.3088713564,
      "rotation_angle": 0.58904862,
      "theta": 0.02454369
    },
    {
      "entropy_drift_bits": 0.0,
      "reduced_entropy_bits": 0.0073113146,
      "rotated_measurement_entropy_bits": 1.4304191645,
      "rotation_angle": 0.65449847,
      "theta": 0.02454369
    },
    {
      "entropy_drift_bits": 0.0,
      "reduced_entropy_bits": 0.0073113146,
      "rotated_measurement_entropy_bits": 1.5282125546,
      "rotation_angle": 0.71994832,
      "theta": 0.02454369
    },
    {
      "entropy_drift_bits": 0.0,
      "reduced_entropy_bits": 0.0073113146,
      "rotated_measurement_entropy_bits": 1.6002219799,
      "rotation_angle": 0.78539816,
      "theta": 0.02454369
    },
    {
      "entropy_drift_bits": 0.0,
      "reduced_entropy_bits": 0.0073113146,
      "rotated_measurement_entropy_bits": 1.6453339673,
      "rotation_angle": 0.85084801,
      "theta": 0.02454369
    },
    {
      "entropy_drift_bits": 0.0,
      "reduced_entropy_bits": 0.0073113146,
      "rotated_measurement_entropy_bits": 1.6633456184,
      "rotation_angle": 0.91629786,
      "theta": 0.02454369
    },
    {
      "entropy_drift_bits": 0.0,
      "reduced_entropy_bits": 0.0073113146,
      "rotated_measurement_entropy_bits": 1.654961386,
      "rotation_angle": 0.9817477,
      "theta": 0.02454369
    },
    {
      "entropy_drift_bits": 0.0,
      "reduced_entropy_bits": 0.0073113146,
      "rotated_measurement_entropy_bits": 1.6217927482,
      "rotation_angle": 1.04719755,
      "theta": 0.02454369
    },
    {
      "entropy_drift_bits": 0.0,
      "reduced_entropy_bits": 0.0073113146,
      "rotated_measurement_entropy_bits": 1.5663641547,
      "rotation_angle": 1.1126474,
      "theta": 0.02454369
    },
    {
      "entropy_drift_bits": 0.0,
      "reduced_entropy_bits": 0.0073113146,
      "rotated_measurement_entropy_bits": 1.4921326028,
      "rotation_angle": 1.17809725,
      "theta": 0.02454369
    },
    {
      "entropy_drift_bits": 0.0,
      "reduced_entropy_bits": 0.0073113146,
      "rotated_measurement_entropy_bits": 1.4035353056,
      "rotation_angle": 1.24354709,
      "theta": 0.02454369
    },
    {
      "entropy_drift_bits": 0.0,
      "reduced_entropy_bits": 0.0073113146,
      "rotated_measurement_entropy_bits": 1.3060947875,
      "rotation_angle": 1.30899694,
      "theta": 0.02454369
    },
    {
      "entropy_drift_bits": 0.0,
      "reduced_entropy_bits": 0.0073113146,
      "rotated_measurement_entropy_bits": 1.2066471768,
      "rotation_angle": 1.37444679,
      "theta": 0.02454369
    },
    {
      "entropy_drift_bits": 0.0,
      "reduced_entropy_bits": 0.0073113146,
      "rotated_measurement_entropy_bits": 1.1138690519,
      "rotation_angle": 1.43989663,
      "theta": 0.02454369
    },
    {
      "entropy_drift_bits": 0.0,
      "reduced_entropy_bits": 0.0073113146,
      "rotated_measurement_entropy_bits": 1.0397456864,
      "rotation_angle": 1.50534648,
      "theta": 0.02454369
    },
    {
      "entropy_drift_bits": 0.0,
      "reduced_entropy_bits": 0.0073113146,